{
  "apiVersion": "plugin.sovrunn.io/v1alpha1",
  "kind": "PluginDefinition",
  "metadata": {
    "name": "provisioning-plugin-v1",
    "uid": "0718293a4b5c6d7e8f901a2b3c4d5e6f",
    "displayName": "Provisioning Plugin Contract",
    "labels": {
      "sovrunn.io/plugin-class": "provisioning"
    },
    "generation": 1,
    "resourceVersion": "rv-plugindef-1",
    "createdAt": "2026-07-04T10:00:00Z",
    "updatedAt": "2026-07-04T10:00:00Z"
  },
  "spec": {
    "version": "1.0.0",
    "compatibilityRange": ">=1.0.0 <2.0.0",
    "publicationState": "Published"
  },
  "status": {
    "phase": "Accepted",
    "conditions": [
      {
        "type": "Accepted",
        "status": "True",
        "reason": "ContractValid",
        "message": "Published definition accepted.",
        "observedGeneration": 1,
        "lastTransitionTime": "2026-07-04T10:00:00Z"
      }
    ]
  }
}
